{
  "claims_boundary": {
    "model_promotion_allowed": false,
    "privacy_clearance_established": false,
    "proof_credit": 0,
    "rights_established": false,
    "training_authorized": false,
    "training_triggered": false
  },
  "counts": {
    "distinct_content_sha256": 9465,
    "duplicate_content_rows": 0,
    "person_rows": 5235,
    "rows": 9465,
    "training_eligible_rows": 0,
    "unique_node_ids": 9465
  },
  "facets": {
    "freshness_state": {
      "CAPTURED_SOURCE_DATE": 34,
      "UNKNOWN_NO_SOURCE_TIMESTAMP": 9267,
      "VERSION_BOUND_NOT_TIME_FRESH": 164
    },
    "kind": {
      "axis": 25,
      "benchmark": 17,
      "dataset": 35,
      "endpoint": 4,
      "estate": 1,
      "formula": 23,
      "lab": 18,
      "org": 106,
      "paper": 1486,
      "person": 5235,
      "repo": 2358,
      "standard": 18,
      "surface": 131,
      "topic": 8
    },
    "license_state": {
      "UNKNOWN_ITEM_LEVEL_LICENSE": 9301,
      "VERSIONED_REPOSITORY_LICENSE": 164
    },
    "safety_decision": {
      "QUARANTINE_LICENSE_UNKNOWN": 4066,
      "QUARANTINE_PERSON_METADATA": 5235,
      "QUARANTINE_RAW_GRAPH_DUPLICATE_FORMULA": 23,
      "QUARANTINE_RAW_GRAPH_NOT_ADMITTED": 141
    },
    "source": {
      "FORMULA_META.organ": 8,
      "GitHub (gh, 2026-07-07)": 48,
      "GitLab (web, 2026-07-07)": 7,
      "SZL charter": 9,
      "academic": 3,
      "arXiv": 70,
      "arxiv": 1369,
      "arxiv-anchor": 50,
      "arxiv-author": 5133,
      "curated": 50,
      "curated-web": 104,
      "github": 2273,
      "harvest": 10,
      "pass2-harvest": 6,
      "szl-estate": 3,
      "versioned-local-graph": 190,
      "web": 132
    },
    "source_family": {
      "a11oy-versioned-runtime": 141,
      "academic-publication-metadata": 1492,
      "authorship-person-metadata": 5235,
      "brain-raw-formula-index": 23,
      "dataset-benchmark-metadata": 44,
      "other-graph-metadata": 3,
      "repository-metadata": 2362,
      "research-landscape-metadata": 165
    },
    "training_decision": {
      "QUARANTINE": 9465
    }
  },
  "integrity": {
    "leaf_domain": "szl.brain.raw-row.v1",
    "merkle_root_sha256": "4a21bc37bf68fcc3267c9bfef5003a3adecb4ab0c8cbfd58592ac6f741367af7",
    "node_domain": "szl.brain.merkle-node.v1",
    "odd_leaf_rule": "DUPLICATE_LAST",
    "row_canonicalization": "SORTED_COMPACT_JSON_UTF8_V1"
  },
  "schema_version": "szl.brain-raw-snapshot.v1",
  "snapshot_sha256": "4eba682e4504b790f905605511ed191fbd5b5f5903711d85001b2adc8c32f152",
  "source": {
    "bytes": 13370772,
    "path": "model_release/m1/brain-ingest-ledger.jsonl",
    "schema": "szl.m1-brain-ingest-decision/v1",
    "sha256": "d2946716f30ae6705f5f6b75ffbac862a42eefb55f2787ec320ed4f0992df8d0"
  }
}
